<?xml version="1.0" encoding="UTF-8"?>
<!--
  restaurant-delivery.xml - Valid sample data for the Food Delivery platform.
  Entities : restaurants (with menus), customers, drivers, orders.
  Links    : orders reference customers / restaurants / drivers / dishes by id
             (customerRef, restaurantRef, driverRef, dishRef).
  Note     : item/@unitPrice is the price at the moment of the order (list price).
             payment/amount = sum(quantity x unitPrice) + delivery/fee.
-->
<foodDelivery version="1.0" generatedOn="2026-10-25"
              xmlns:xsi="http://www.w3.org/2001/XMLSchema-instance"
              xsi:noNamespaceSchemaLocation="restaurant-delivery.xsd">

  <!-- =================================================================== -->
  <restaurants>

    <restaurant id="R001" status="open">
      <name>Bella Napoli Pizzeria</name>
      <cuisine>Italian</cuisine>
      <address>
        <street>12 Rue de la Paix</street>
        <city>Paris</city>
        <postalCode>75002</postalCode>
        <country>France</country>
      </address>
      <phone>+33 1 42 00 11 22</phone>
      <email>contact@bellanapoli.example.com</email>
      <rating>4.6</rating>
      <deliveryRadiusKm>6</deliveryRadiusKm>
      <minimumOrder currency="EUR">12.00</minimumOrder>
      <openingHours>
        <day name="Monday"    open="11:00" close="23:00"/>
        <day name="Tuesday"   open="11:00" close="23:00"/>
        <day name="Wednesday" open="11:00" close="23:00"/>
        <day name="Thursday"  open="11:00" close="23:00"/>
        <day name="Friday"    open="11:00" close="23:30"/>
        <day name="Saturday"  open="11:00" close="23:30"/>
        <day name="Sunday"    open="12:00" close="22:00"/>
      </openingHours>
      <menu>
        <category name="Pizzas">
          <dish id="D001" available="true" vegetarian="true" spicy="false">
            <name>Pizza Margherita</name>
            <description>Tomato sauce, fresh mozzarella and basil</description>
            <price currency="EUR">9.50</price>
            <promotion discountPercent="20" validUntil="2026-12-31"/>
            <calories>780</calories>
            <allergens><allergen>gluten</allergen><allergen>dairy</allergen></allergens>
          </dish>
          <dish id="D002" available="true" vegetarian="false" spicy="true">
            <name>Pizza Diavola</name>
            <description>Spicy salami, chili oil, mozzarella</description>
            <price currency="EUR">12.00</price>
            <calories>920</calories>
            <allergens><allergen>gluten</allergen><allergen>dairy</allergen></allergens>
          </dish>
        </category>
        <category name="Pasta">
          <dish id="D003" available="true" vegetarian="false" spicy="false">
            <name>Spaghetti Carbonara</name>
            <description>Egg, pecorino, guanciale and black pepper</description>
            <price currency="EUR">13.50</price>
            <calories>850</calories>
            <allergens><allergen>gluten</allergen><allergen>dairy</allergen><allergen>eggs</allergen></allergens>
          </dish>
          <dish id="D004" available="true" vegetarian="true" spicy="true">
            <name>Penne Arrabbiata</name>
            <description>Tomato, garlic and red chili</description>
            <price currency="EUR">11.00</price>
            <calories>640</calories>
            <allergens><allergen>gluten</allergen></allergens>
          </dish>
        </category>
        <category name="Desserts">
          <dish id="D005" available="true" vegetarian="true" spicy="false">
            <name>Tiramisu</name>
            <description>Mascarpone cream, espresso-soaked biscuits, cocoa</description>
            <price currency="EUR">6.50</price>
            <promotion discountPercent="10" validUntil="2026-11-30"/>
            <calories>450</calories>
            <allergens><allergen>gluten</allergen><allergen>dairy</allergen><allergen>eggs</allergen></allergens>
          </dish>
        </category>
      </menu>
    </restaurant>

    <restaurant id="R002" status="open">
      <name>Sakura Sushi House</name>
      <cuisine>Japanese</cuisine>
      <address>
        <street>8 Avenue Victor Hugo</street>
        <city>Lyon</city>
        <postalCode>69002</postalCode>
        <country>France</country>
      </address>
      <phone>+33 4 72 00 33 44</phone>
      <email>hello@sakurasushi.example.com</email>
      <rating>4.8</rating>
      <deliveryRadiusKm>8</deliveryRadiusKm>
      <minimumOrder currency="EUR">15.00</minimumOrder>
      <openingHours>
        <day name="Monday"    open="11:30" close="22:30"/>
        <day name="Tuesday"   open="11:30" close="22:30"/>
        <day name="Wednesday" open="11:30" close="22:30"/>
        <day name="Thursday"  open="11:30" close="22:30"/>
        <day name="Friday"    open="11:30" close="23:00"/>
        <day name="Saturday"  open="11:30" close="23:00"/>
        <day name="Sunday"    open="12:00" close="22:00"/>
      </openingHours>
      <menu>
        <category name="Sushi">
          <dish id="D006" available="true" vegetarian="false" spicy="false">
            <name>Salmon Nigiri Set</name>
            <description>8 pieces of fresh salmon nigiri</description>
            <price currency="EUR">14.90</price>
            <calories>420</calories>
            <allergens><allergen>fish</allergen><allergen>soy</allergen></allergens>
          </dish>
          <dish id="D007" available="true" vegetarian="false" spicy="false">
            <name>California Roll (8 pcs)</name>
            <description>Crab, avocado, cucumber, sesame</description>
            <price currency="EUR">10.50</price>
            <promotion discountPercent="15" validUntil="2026-12-15"/>
            <calories>380</calories>
            <allergens><allergen>shellfish</allergen><allergen>sesame</allergen><allergen>soy</allergen></allergens>
          </dish>
        </category>
        <category name="Hot Dishes">
          <dish id="D008" available="true" vegetarian="true" spicy="false">
            <name>Vegetable Tempura</name>
            <description>Crispy seasonal vegetables with tentsuyu sauce</description>
            <price currency="EUR">8.90</price>
            <calories>360</calories>
            <allergens><allergen>gluten</allergen></allergens>
          </dish>
          <dish id="D009" available="true" vegetarian="false" spicy="false">
            <name>Chicken Ramen</name>
            <description>Rich chicken broth, noodles, soft egg, nori</description>
            <price currency="EUR">13.00</price>
            <calories>690</calories>
            <allergens><allergen>gluten</allergen><allergen>soy</allergen><allergen>eggs</allergen></allergens>
          </dish>
        </category>
        <category name="Drinks and Sweets">
          <dish id="D010" available="true" vegetarian="true" spicy="false">
            <name>Iced Green Tea</name>
            <price currency="EUR">3.50</price>
            <calories>5</calories>
          </dish>
          <dish id="D022" available="false" vegetarian="true">
            <name>Matcha Mochi</name>
            <description>Seasonal item - currently out of stock</description>
            <price currency="EUR">5.50</price>
            <calories>210</calories>
            <allergens><allergen>soy</allergen></allergens>
          </dish>
        </category>
      </menu>
    </restaurant>

    <restaurant id="R003" status="open">
      <name>Burger Republic</name>
      <cuisine>American</cuisine>
      <address>
        <street>25 Boulevard Haussmann</street>
        <city>Paris</city>
        <postalCode>75009</postalCode>
        <country>France</country>
      </address>
      <phone>+33 1 40 00 55 66</phone>
      <rating>4.2</rating>
      <deliveryRadiusKm>5</deliveryRadiusKm>
      <minimumOrder currency="EUR">10.00</minimumOrder>
      <openingHours>
        <day name="Monday"    open="11:00" close="23:00"/>
        <day name="Tuesday"   open="11:00" close="23:00"/>
        <day name="Wednesday" open="11:00" close="23:00"/>
        <day name="Thursday"  open="11:00" close="23:00"/>
        <day name="Friday"    open="11:00" close="00:00"/>
        <day name="Saturday"  open="11:00" close="00:00"/>
      </openingHours>
      <menu>
        <category name="Burgers">
          <dish id="D011" available="true" vegetarian="false" spicy="false">
            <name>Classic Cheeseburger</name>
            <description>Beef patty, cheddar, pickles, house sauce</description>
            <price currency="EUR">11.50</price>
            <calories>870</calories>
            <allergens><allergen>gluten</allergen><allergen>dairy</allergen><allergen>sesame</allergen></allergens>
          </dish>
          <dish id="D012" available="true" vegetarian="false" spicy="true">
            <name>Spicy Chicken Burger</name>
            <description>Crispy chicken, jalapenos, spicy mayo</description>
            <price currency="EUR">12.50</price>
            <promotion discountPercent="25" validUntil="2026-11-15"/>
            <calories>810</calories>
            <allergens><allergen>gluten</allergen><allergen>eggs</allergen></allergens>
          </dish>
          <dish id="D013" available="true" vegetarian="true" spicy="false">
            <name>Veggie Garden Burger</name>
            <description>Plant-based patty, avocado, tomato</description>
            <price currency="EUR">12.00</price>
            <calories>640</calories>
            <allergens><allergen>gluten</allergen><allergen>soy</allergen></allergens>
          </dish>
        </category>
        <category name="Sides and Drinks">
          <dish id="D014" available="true" vegetarian="true" spicy="false">
            <name>Sweet Potato Fries</name>
            <price currency="EUR">5.00</price>
            <calories>420</calories>
          </dish>
          <dish id="D015" available="true" vegetarian="true" spicy="false">